{
  "schema_version": 1,
  "skill_version": "4.1.0",
  "created_utc": "",
  "mode": "maximum-autonomy",
  "risk_cap": "MEDIUM",
  "fail_closed": true,
  "budgets": {
    "tokens": null,
    "minutes": null,
    "money": 0,
    "compute": "local",
    "network": true
  },
  "permissions": {
    "local_read": true,
    "local_write": true,
    "execute": true,
    "network": true,
    "external_write": false,
    "publish": false,
    "submit": false,
    "auto_hire": true,
    "protocol_change": true,
    "scientific_decision": true,
    "delete": false
  },
  "standing_authorizations": []
}
